7,Micheal,Hugo,2/17/03,Boy,Guitar,,,Accept,7/2/17,YES,YES,YES,7,,,Guitarist
8,Elsa,Princess,3/22/04,Girl,Piano,,,Accept,7/8/17,YES,YES,YES,8,,,Instrumentalist
9,Laird,Probert,8/30/99,Girl,Guitar,,,Deny,5/5/17,YES,YES,YES,7,Quisque id justo sit amet sapien dignissim vestibulum.,Aliquam quis turpis eget elit sodales scelerisque.,Singer
10,Paulie,Peile,9/20/02,Girl,Instrument,,,Accept,5/10/17,YES,YES,YES,10,Sed vel enim sit amet nunc viverra dapibus.,Phasellus sit amet erat.,Keyboardist
11,Colas,Hallad,2/23/00,Boy,Singer,,,Deny,6/24/17,YES,YES,YES,8,"Maecenas leo odio, condimentum id, luctus nec, molestie sed, justo.",Nulla ut erat id mauris vulputate elementum.,Instrumentalist
12,Jacquenette,Roylance,7/12/03,Boy,Drum,,,Deny,6/21/17,YES,YES,YES,7,Fusce consequat.,In hac habitasse platea dictumst.,Instrumentalist
13,Willi,Glassborow,10/6/04,Boy,Instrument,,,Deny,5/13/17,YES,YES,YES,3,Integer ac leo.,"Cum sociis natoque penatibus et magnis dis parturient montes, nascetur ridiculus mus.",Bassist
14,Perla,Hainge,8/24/99,Girl,Singer,,,Deny,5/5/17,YES,YES,YES,10,Donec posuere metus vitae ipsum.,"Maecenas leo odio, condimentum id, luctus nec, molestie sed, justo.",Keyboardist
15,Rainer,Balharry,9/15/03,Boy,Instrument,,,Deny,5/16/17,YES,YES,YES,4,Sed sagittis.,"Donec odio justo, sollicitudin ut, suscipit a, feugiat et, eros.",Singer
16,Gael,O'Brogane,1/28/99,Girl,Guitar,,,Deny,6/10/17,YES,YES,YES,5,Nulla ac enim.,Fusce posuere felis sed lacus.,Drummer
17,Christy,Vowells,11/4/03,Boy,Bass,,,Deny,5/26/17,YES,YES,YES,8,Morbi quis tortor id nulla ultrices aliquet.,Vivamus tortor.,Drummer
18,Julita,Benedetti,8/2/02,Girl,Drum,,,Deny,7/19/17,YES,YES,YES,5,"Morbi vestibulum, velit id pretium iaculis, diam erat fermentum justo, nec condimentum neque sapien placerat ante.",Nam nulla.,Bassist
19,Gale,Henrys,7/21/99,Boy,Instrument,,,Deny,5/22/17,YES,YES,YES,3,Donec vitae nisi.,"Maecenas tristique, est et tempus semper, est quam pharetra magna, ac consequat metus sapien ut nunc.",Drummer
20,Nicola,Hischke,12/10/04,Girl,Singer,,,Deny,6/9/17,YES,YES,YES,5,Suspendisse potenti.,Etiam pretium iaculis justo.,Keyboardist
21,Elyn,Jago,7/27/02,Girl,Keyboard,,,Deny,7/12/17,YES,YES,YES,5,Nunc rhoncus dui vel sem.,"Duis bibendum, felis sed interdum venenatis, turpis enim blandit mi, in porttitor pede justo eu massa.",Keyboardist
22,Astrid,Gorling,9/10/00,Boy,Bass,,,Accept,7/22/17,YES,YES,YES,5,Phasellus id sapien in sapien iaculis congue.,Donec semper sapien a libero.,Drummer
23,Reina,Spon,11/24/03,Girl,Bass,,,Deny,7/30/17,YES,YES,YES,7,Donec quis orci eget orci vehicula condimentum.,"Mauris enim leo, rhoncus sed, vestibulum sit amet, cursus id, turpis.",Guitarist
24,Caresse,Edie,12/9/99,Boy,Instrument,,,Deny,7/3/17,YES,YES,YES,4,In hac habitasse platea dictumst.,Ut at dolor quis odio consequat varius.,Instrumentalist
25,Glad,Jeste,11/3/01,Girl,Keyboard,,,Deny,5/7/17,YES,YES,YES,4,Sed sagittis.,Nunc purus.,Drummer
26,Gery,Kirley,4/12/03,Girl,Keyboard,,,Accept,6/5/17,YES,YES,YES,9,Vestibulum rutrum rutrum neque.,Morbi a ipsum.,Keyboardist
27,Collie,Westphal,1/28/04,Boy,Singer,,,Accept,6/1/17,YES,YES,YES,3,Praesent blandit lacinia erat.,Vestibulum ante ipsum primis in faucibus orci luctus et ultrices posuere cubilia Curae; Duis faucibus accumsan odio.,Instrumentalist
28,Dannie,Creech,4/6/99,Boy,Singer,,,Accept,5/5/17,YES,YES,YES,4,Aliquam quis turpis eget elit sodales scelerisque.,Mauris sit amet eros.,Keyboardist
29,Aprilette,Jirusek,10/5/04,Boy,Drum,,,Accept,6/19/17,YES,YES,YES,8,Suspendisse potenti.,Morbi quis tortor id nulla ultrices aliquet.,Guitarist
30,Sammie,Galbraith,4/22/02,Girl,Keyboard,,,Deny,7/9/17,YES,YES,YES,9,"Integer pede justo, lacinia eget, tincidunt eget, tempus vel, pede.",Maecenas pulvinar lobortis est.,Bassist
31,Leanor,Roder,10/24/04,Girl,Keyboard,,,Deny,6/27/17,YES,YES,YES,4,"Maecenas tristique, est et tempus semper, est quam pharetra magna, ac consequat metus sapien ut nunc.",Donec vitae nisi.,Bassist
32,Blaire,Tilbrook,6/24/01,Boy,Guitar,,,Deny,7/14/17,YES,YES,YES,2,Aliquam erat volutpat.,"Mauris enim leo, rhoncus sed, vestibulum sit amet, cursus id, turpis.",Bassist
33,My,Skade,1/30/04,Boy,Instrument,,,Deny,7/16/17,YES,YES,YES,9,Cras pellentesque volutpat dui.,In hac habitasse platea dictumst.,Drummer
34,Johnathon,Giorgio,6/21/99,Girl,Keyboard,,,Accept,5/28/17,YES,YES,YES,2,Duis bibendum.,"Morbi sem mauris, laoreet ut, rhoncus aliquet, pulvinar sed, nisl.",Singer
35,Brandon,Cribbott,1/31/02,Girl,Bass,,,Deny,6/6/17,YES,YES,YES,2,"Fusce lacus purus, aliquet at, feugiat non, pretium quis, lectus.",Nulla mollis molestie lorem.,Singer
36,Karisa,Bennedsen,7/11/00,Girl,Drum,,,Accept,7/16/17,YES,YES,YES,6,Vivamus in felis eu sapien cursus vestibulum.,Pellentesque eget nunc.,Drummer
37,Flory,Rude,10/30/00,Girl,Drum,,,Accept,5/15/17,YES,YES,YES,7,Morbi non lectus.,Praesent lectus.,Singer
38,Lesly,Siemandl,6/30/99,Boy,Instrument,,,Deny,7/26/17,YES,YES,YES,10,In hac habitasse platea dictumst.,Etiam justo.,Singer
39,Letty,Fidler,10/2/01,Boy,Instrument,,,Deny,6/29/17,YES,YES,YES,6,Aliquam quis turpis eget elit sodales scelerisque.,Nulla ac enim.,Singer
40,Lanie,Gook,9/24/00,Girl,Drum,,,Accept,5/20/17,YES,YES,YES,7,Nam nulla.,Maecenas ut massa quis augue luctus tincidunt.,Singer
41,Ezmeralda,Jost,5/2/00,Boy,Singer,,,Accept,7/22/17,YES,YES,YES,5,"Lorem ipsum dolor sit amet, consectetuer adipiscing elit.",Nulla ac enim.,Singer
42,Kellie,Rasor,7/27/03,Girl,Instrument,,,Deny,7/3/17,YES,YES,YES,3,Nunc purus.,Morbi a ipsum.,Instrumentalist
43,Winifred,Likly,12/30/02,Girl,Keyboard,,,Deny,5/13/17,YES,YES,YES,4,Praesent blandit lacinia erat.,Sed vel enim sit amet nunc viverra dapibus.,Keyboardist
44,Cass,Kosel,3/24/99,Girl,Singer,,,Accept,6/5/17,YES,YES,YES,7,Pellentesque eget nunc.,Donec semper sapien a libero.,Guitarist
45,Gibbie,Blasio,9/9/00,Boy,Keyboard,,,Deny,7/31/17,YES,YES,YES,5,Ut tellus.,Suspendisse ornare consequat lectus.,Guitarist
46,Paloma,Schneider,12/17/01,Girl,Keyboard,,,Accept,6/8/17,YES,YES,YES,6,"Donec diam neque, vestibulum eget, vulputate ut, ultrices vel, augue.",Pellentesque viverra pede ac diam.,Instrumentalist
47,Virgie,Outibridge,8/14/99,Girl,Keyboard,,,Accept,6/6/17,YES,YES,YES,7,Aliquam non mauris.,Integer non velit.,Bassist
48,Catina,Palleske,1/26/02,Boy,Instrument,,,Accept,5/26/17,YES,YES,YES,8,Etiam pretium iaculis justo.,Vestibulum ac est lacinia nisi venenatis tristique.,Guitarist
49,Leonanie,Armall,5/13/01,Girl,Drum,,,Deny,5/22/17,YES,YES,YES,7,Vestibulum ante ipsum primis in faucibus orci luctus et ultrices posuere cubilia Curae; Duis faucibus accumsan odio.,In hac habitasse platea dictumst.,Singer
50,Dmitri,Bondley,4/15/00,Boy,Drum,,,Accept,6/20/17,YES,YES,YES,6,Nulla facilisi.,Morbi non lectus.,Guitarist
51,Clayson,Fromant,8/12/00,Boy,Drum,,,Accept,6/3/17,YES,YES,YES,9,"Nullam orci pede, venenatis non, sodales sed, tincidunt eu, felis.",Maecenas rhoncus aliquam lacus.,Bassist
52,Arthur,Harmour,7/11/01,Girl,Bass,,,Deny,6/27/17,YES,YES,YES,8,Morbi quis tortor id nulla ultrices aliquet.,Donec dapibus.,Guitarist
53,Sadella,Shrieve,3/23/99,Girl,Singer,,,Accept,7/31/17,YES,YES,YES,6,"Integer pede justo, lacinia eget, tincidunt eget, tempus vel, pede.",Integer ac leo.,Keyboardist
54,Neill,Goede,7/5/99,Girl,Bass,,,Accept,6/15/17,YES,YES,YES,3,"Cum sociis natoque penatibus et magnis dis parturient montes, nascetur ridiculus mus.",Quisque id justo sit amet sapien dignissim vestibulum.,Guitarist
55,Courtney,Willshere,9/3/02,Boy,Instrument,,,Accept,5/5/17,YES,YES,YES,6,"Maecenas tristique, est et tempus semper, est quam pharetra magna, ac consequat metus sapien ut nunc.","Nam congue, risus semper porta volutpat, quam pede lobortis ligula, sit amet eleifend pede libero quis orci.",Singer
56,Elspeth,Jime,5/18/00,Boy,Guitar,,,Deny,7/11/17,YES,YES,YES,9,Duis bibendum.,In eleifend quam a odio.,Bassist
57,Margaretta,Mahaddie,5/20/01,Girl,Drum,,,Accept,6/28/17,YES,YES,YES,3,Praesent lectus.,In congue.,Instrumentalist
58,Shandy,Collishaw,10/26/00,Boy,Bass,,,Deny,6/2/17,YES,YES,YES,10,"Quisque erat eros, viverra eget, congue eget, semper rutrum, nulla.","Fusce lacus purus, aliquet at, feugiat non, pretium quis, lectus.",Drummer
59,Giusto,Fussey,9/9/01,Girl,Instrument,,,Accept,7/17/17,YES,YES,YES,3,Donec vitae nisi.,Phasellus in felis.,Guitarist
60,Justinian,Dusting,4/11/02,Girl,Singer,,,Accept,5/17/17,YES,YES,YES,2,Sed sagittis.,Curabitur gravida nisi at nibh.,Keyboardist
61,Christina,Dando,8/17/04,Girl,Singer,,,Accept,7/26/17,YES,YES,YES,2,"Morbi sem mauris, laoreet ut, rhoncus aliquet, pulvinar sed, nisl.",Suspendisse accumsan tortor quis turpis.,Bassist
62,Barbi,Deaton,8/18/01,Boy,Singer,,,Deny,6/9/17,YES,YES,YES,9,Integer a nibh.,Aliquam sit amet diam in magna bibendum imperdiet.,Guitarist
63,Katleen,Norewood,6/14/99,Girl,Keyboard,,,Deny,7/29/17,YES,YES,YES,4,Donec dapibus.,Etiam faucibus cursus urna.,Drummer
64,Erma,Streatley,5/26/00,Girl,Guitar,,,Deny,6/27/17,YES,YES,YES,9,"Fusce lacus purus, aliquet at, feugiat non, pretium quis, lectus.",Fusce posuere felis sed lacus.,Bassist
65,Nedi,Klemz,8/5/99,Boy,Instrument,,,Accept,6/22/17,YES,YES,YES,2,Proin eu mi.,Morbi quis tortor id nulla ultrices aliquet.,Bassist
66,Nellie,Coady,1/16/02,Girl,Guitar,,,Deny,7/4/17,YES,YES,YES,2,Quisque id justo sit amet sapien dignissim vestibulum.,Cras non velit nec nisi vulputate nonummy.,Instrumentalist
67,Hamish,Pilmoor,6/12/03,Girl,Bass,,,Deny,5/14/17,YES,YES,YES,7,Donec posuere metus vitae ipsum.,"Morbi vestibulum, velit id pretium iaculis, diam erat fermentum justo, nec condimentum neque sapien placerat ante.",Bassist
68,Delainey,Merfin,11/22/02,Boy,Instrument,,,Accept,5/27/17,YES,YES,YES,2,In blandit ultrices enim.,Cras non velit nec nisi vulputate nonummy.,Singer
69,Farleigh,Talton,11/8/03,Girl,Singer,,,Deny,7/12/17,YES,YES,YES,5,Curabitur gravida nisi at nibh.,Duis aliquam convallis nunc.,Keyboardist
70,Lia,Gather,7/4/01,Girl,Keyboard,,,Accept,6/14/17,YES,YES,YES,3,Aenean sit amet justo.,Donec semper sapien a libero.,Bassist
71,Anton,Mealham,9/1/02,Girl,Guitar,,,Accept,6/4/17,YES,YES,YES,9,"Cum sociis natoque penatibus et magnis dis parturient montes, nascetur ridiculus mus.",Suspendisse potenti.,Drummer
72,Irina,Tyreman,3/20/99,Boy,Singer,,,Accept,7/6/17,YES,YES,YES,4,Morbi non lectus.,Suspendisse accumsan tortor quis turpis.,Drummer
73,Collete,Dehn,10/24/04,Boy,Drum,,,Accept,5/19/17,YES,YES,YES,3,Morbi non lectus.,"Cras mi pede, malesuada in, imperdiet et, commodo vulputate, justo.",Drummer
74,Hedvige,Jelf,7/28/99,Boy,Instrument,,,Deny,7/29/17,YES,YES,YES,2,In quis justo.,Nunc nisl.,Drummer
75,Matthus,Gerrett,3/14/02,Girl,Drum,,,Accept,7/18/17,YES,YES,YES,4,Nulla justo.,"In est risus, auctor sed, tristique in, tempus sit amet, sem.",Guitarist
76,Roz,Sumpter,2/16/03,Girl,Drum,,,Accept,7/31/17,YES,YES,YES,7,Fusce consequat.,Donec dapibus.,Instrumentalist
77,Fitz,Nunan,9/7/99,Boy,Singer,,,Accept,6/14/17,YES,YES,YES,2,In blandit ultrices enim.,In hac habitasse platea dictumst.,Instrumentalist
78,Virginie,Runham,11/11/01,Girl,Instrument,,,Deny,6/10/17,YES,YES,YES,7,Integer tincidunt ante vel ipsum.,"Morbi vestibulum, velit id pretium iaculis, diam erat fermentum justo, nec condimentum neque sapien placerat ante.",Singer
79,Sheelagh,Tinkler,4/6/02,Girl,Instrument,,,Deny,7/2/17,YES,YES,YES,3,Nullam porttitor lacus at turpis.,"In est risus, auctor sed, tristique in, tempus sit amet, sem.",Keyboardist
80,Esther,Stickney,4/25/02,Girl,Keyboard,,,Accept,7/28/17,YES,YES,YES,3,Aliquam quis turpis eget elit sodales scelerisque.,Etiam pretium iaculis justo.,Bassist
81,Mildred,Arias,5/30/02,Girl,Instrument,,,Deny,6/1/17,YES,YES,YES,6,Etiam pretium iaculis justo.,Donec semper sapien a libero.,Instrumentalist
82,Polly,Stonuary,3/29/02,Boy,Keyboard,,,Deny,7/31/17,YES,YES,YES,5,Curabitur gravida nisi at nibh.,Nunc purus.,Instrumentalist
83,Hortensia,MacCoveney,6/25/01,Boy,Guitar,,,Accept,6/1/17,YES,YES,YES,3,Maecenas pulvinar lobortis est.,Nullam varius.,Drummer
84,Tod,Pauluzzi,10/7/00,Boy,Instrument,,,Accept,7/1/17,YES,YES,YES,10,Aliquam sit amet diam in magna bibendum imperdiet.,"Donec diam neque, vestibulum eget, vulputate ut, ultrices vel, augue.",Guitarist
85,Rockwell,Wotherspoon,3/25/02,Boy,Bass,,,Deny,6/6/17,YES,YES,YES,6,Nulla mollis molestie lorem.,Nullam porttitor lacus at turpis.,Bassist
86,Sissie,Hazeley,1/6/02,Girl,Instrument,,,Accept,7/28/17,YES,YES,YES,9,Vivamus vel nulla eget eros elementum pellentesque.,Vestibulum ac est lacinia nisi venenatis tristique.,Drummer
87,Willamina,Dashkov,3/12/02,Boy,Singer,,,Accept,6/29/17,YES,YES,YES,6,Cras pellentesque volutpat dui.,Sed sagittis.,Singer
88,Bronny,Cawley,6/30/02,Boy,Singer,,,Accept,6/19/17,YES,YES,YES,9,Curabitur convallis.,Aliquam non mauris.,Keyboardist
89,Devora,Kilgallon,11/17/00,Boy,Keyboard,,,Deny,6/2/17,YES,YES,YES,6,Curabitur gravida nisi at nibh.,Suspendisse accumsan tortor quis turpis.,Guitarist
90,Evin,Heber,5/18/01,Boy,Bass,,,Accept,5/13/17,YES,YES,YES,7,Etiam vel augue.,"Proin leo odio, porttitor id, consequat in, consequat ut, nulla.",Bassist
91,Ginevra,Stittle,4/15/03,Boy,Singer,,,Accept,7/18/17,YES,YES,YES,6,Etiam vel augue.,"In tempor, turpis nec euismod scelerisque, quam turpis adipiscing lorem, vitae mattis nibh ligula nec sem.",Instrumentalist
92,Tresa,Cuesta,1/22/02,Girl,Keyboard,,,Deny,5/2/17,YES,YES,YES,1,Donec dapibus.,Proin risus.,Keyboardist
93,Barret,Meco,12/1/01,Boy,Keyboard,,,Deny,5/30/17,YES,YES,YES,3,Pellentesque eget nunc.,"Donec diam neque, vestibulum eget, vulputate ut, ultrices vel, augue.",Bassist
94,Henderson,Britch,12/18/03,Girl,Guitar,,,Accept,7/17/17,YES,YES,YES,5,Morbi ut odio.,Aliquam non mauris.,Singer
95,Selle,Drabble,2/21/04,Boy,Keyboard,,,Accept,6/25/17,YES,YES,YES,6,Fusce consequat.,Aliquam sit amet diam in magna bibendum imperdiet.,Bassist
96,Ken,Patis,7/5/99,Boy,Keyboard,,,Accept,5/25/17,YES,YES,YES,5,Pellentesque ultrices mattis odio.,Nunc purus.,Instrumentalist
97,Rochelle,Oiller,1/13/01,Girl,Keyboard,,,Deny,6/27/17,YES,YES,YES,5,"Morbi sem mauris, laoreet ut, rhoncus aliquet, pulvinar sed, nisl.",In congue.,Singer
98,Maxy,Lammin,9/29/04,Boy,Drum,,,Accept,7/18/17,YES,YES,YES,6,Pellentesque viverra pede ac diam.,Nulla ut erat id mauris vulputate elementum.,Keyboardist
99,Teresa,Fewell,7/10/02,Boy,Guitar,,,Accept,6/11/17,YES,YES,YES,9,Duis aliquam convallis nunc.,Curabitur in libero ut massa volutpat convallis.,Keyboardist
100,Jacklyn,Pallent,11/26/01,Girl,Keyboard,,,Accept,7/4/17,YES,YES,YES,8,"In tempor, turpis nec euismod scelerisque, quam turpis adipiscing lorem, vitae mattis nibh ligula nec sem.",Duis consequat dui nec nisi volutpat eleifend.,Drummer